{
  "$schema": "https://schema.evideris.com/schemas/kpi.schema.json",
  "$id": "https://schema.evideris.com/esge/kpi/emr-colon/min-30-cases.v1.0.0.json",
  "lineageId": "kpi-emr-cln-30-cases-min",
  "type": "kpi",
  "version": "1.0.0",
  "release": "r2026.07",
  "supersedes": null,
  "supersededBy": null,
  "language": [
    "en"
  ],
  "withinCurriculum": "cur-emr-colon-2023",
  "title": {
    "en": "Prior to independent practice, a minimum of 30 EMR procedures should be performed, culminating in a trainer-guided assessment of competency using a validated assessment tool, taking account of procedural difficulty (e. g. using the SMSA polyp score)."
  },
  "metric": {
    "en": "Prior to independent practice, a minimum of 30 EMR procedures should be performed, culminating in a trainer-guided assessment of competency using a validated assessment tool, taking account of procedural difficulty (e. g. using the SMSA polyp score)."
  },
  "unit": "procedures",
  "desiredStandard": 30,
  "minimumStandard": 30,
  "originData": {
    "source": "delphi",
    "value": null,
    "confidenceInterval95": null
  },
  "levelOfAgreement": 83,
  "appliesTo": "trainee",
  "derivedFromRecommendation": "rec-emr-cln-r37-completion-training-emr",
  "_meta": {
    "provenance": {
      "type": "paraphrased",
      "source_doi": "10.1055/a-2077-0497",
      "source_span": "Prior to independent practice, a minimum of 30 EMR procedures should be performed, culminating in a trainer-guided assessment of competency using a validated assessment tool, taking account of procedural difficulty (e.g. using the SMSA polyp score)."
    },
    "encodedBy": "human:david",
    "encodedAt": "2026-06-27"
  }
}
